{
  "schemaVersion": 1,
  "generatorVersion": 1,
  "sourceRoot": "src/app/api",
  "routeFileCount": 89,
  "discoveredOperationCount": 103,
  "discoveredOperations": [
    {
      "operationId": "api:GET:/api/bins",
      "method": "GET",
      "path": "/api/bins",
      "source": {
        "file": "src/app/api/bins/route.ts",
        "exportKind": "function-declaration",
        "localName": "GET",
        "moduleSpecifier": null
      }
    },
    {
      "operationId": "api:POST:/api/bins",
      "method": "POST",
      "path": "/api/bins",
      "source": {
        "file": "src/app/api/bins/route.ts",
        "exportKind": "function-declaration",
        "localName": "POST",
        "moduleSpecifier": null
      }
    },
    {
      "operationId": "api:PATCH:/api/bins/{param}",
      "method": "PATCH",
      "path": "/api/bins/[id]",
      "source": {
        "file": "src/app/api/bins/[id]/route.ts",
        "exportKind": "function-declaration",
        "localName": "PATCH",
        "moduleSpecifier": null
      }
    },
    {
      "operationId": "api:GET:/api/bins/suggest",
      "method": "GET",
      "path": "/api/bins/suggest",
      "source": {
        "file": "src/app/api/bins/suggest/route.ts",
        "exportKind": "function-declaration",
        "localName": "GET",
        "moduleSpecifier": null
      }
    },
    {
      "operationId": "api:POST:/api/brand-kit",
      "method": "POST",
      "path": "/api/brand-kit",
      "source": {
        "file": "src/app/api/brand-kit/route.ts",
        "exportKind": "function-declaration",
        "localName": "POST",
        "moduleSpecifier": null
      }
    },
    {
      "operationId": "api:POST:/api/brand-kit/propose",
      "method": "POST",
      "path": "/api/brand-kit/propose",
      "source": {
        "file": "src/app/api/brand-kit/propose/route.ts",
        "exportKind": "function-declaration",
        "localName": "POST",
        "moduleSpecifier": null
      }
    },
    {
      "operationId": "api:POST:/api/cellar",
      "method": "POST",
      "path": "/api/cellar",
      "source": {
        "file": "src/app/api/cellar/route.ts",
        "exportKind": "function-declaration",
        "localName": "POST",
        "moduleSpecifier": null
      }
    },
    {
      "operationId": "api:POST:/api/cellar-health/recompute",
      "method": "POST",
      "path": "/api/cellar-health/recompute",
      "source": {
        "file": "src/app/api/cellar-health/recompute/route.ts",
        "exportKind": "function-declaration",
        "localName": "POST",
        "moduleSpecifier": null
      }
    },
    {
      "operationId": "api:PATCH:/api/cellar/{param}",
      "method": "PATCH",
      "path": "/api/cellar/[id]",
      "source": {
        "file": "src/app/api/cellar/[id]/route.ts",
        "exportKind": "function-declaration",
        "localName": "PATCH",
        "moduleSpecifier": null
      }
    },
    {
      "operationId": "api:DELETE:/api/cellar/{param}",
      "method": "DELETE",
      "path": "/api/cellar/[id]",
      "source": {
        "file": "src/app/api/cellar/[id]/route.ts",
        "exportKind": "function-declaration",
        "localName": "DELETE",
        "moduleSpecifier": null
      }
    },
    {
      "operationId": "api:PATCH:/api/cellar/{param}/section",
      "method": "PATCH",
      "path": "/api/cellar/[id]/section",
      "source": {
        "file": "src/app/api/cellar/[id]/section/route.ts",
        "exportKind": "function-declaration",
        "localName": "PATCH",
        "moduleSpecifier": null
      }
    },
    {
      "operationId": "api:POST:/api/cellar/batch-section",
      "method": "POST",
      "path": "/api/cellar/batch-section",
      "source": {
        "file": "src/app/api/cellar/batch-section/route.ts",
        "exportKind": "function-declaration",
        "localName": "POST",
        "moduleSpecifier": null
      }
    },
    {
      "operationId": "api:GET:/api/cellar/config",
      "method": "GET",
      "path": "/api/cellar/config",
      "source": {
        "file": "src/app/api/cellar/config/route.ts",
        "exportKind": "function-declaration",
        "localName": "GET",
        "moduleSpecifier": null
      }
    },
    {
      "operationId": "api:POST:/api/cellar/config",
      "method": "POST",
      "path": "/api/cellar/config",
      "source": {
        "file": "src/app/api/cellar/config/route.ts",
        "exportKind": "function-declaration",
        "localName": "POST",
        "moduleSpecifier": null
      }
    },
    {
      "operationId": "api:PATCH:/api/cellar/config",
      "method": "PATCH",
      "path": "/api/cellar/config",
      "source": {
        "file": "src/app/api/cellar/config/route.ts",
        "exportKind": "function-declaration",
        "localName": "PATCH",
        "moduleSpecifier": null
      }
    },
    {
      "operationId": "api:GET:/api/cellar/grid",
      "method": "GET",
      "path": "/api/cellar/grid",
      "source": {
        "file": "src/app/api/cellar/grid/route.ts",
        "exportKind": "function-declaration",
        "localName": "GET",
        "moduleSpecifier": null
      }
    },
    {
      "operationId": "api:GET:/api/dev-login",
      "method": "GET",
      "path": "/api/dev-login",
      "source": {
        "file": "src/app/api/dev-login/route.ts",
        "exportKind": "function-declaration",
        "localName": "GET",
        "moduleSpecifier": null
      }
    },
    {
      "operationId": "api:GET:/api/export/toast-csv",
      "method": "GET",
      "path": "/api/export/toast-csv",
      "source": {
        "file": "src/app/api/export/toast-csv/route.ts",
        "exportKind": "function-declaration",
        "localName": "GET",
        "moduleSpecifier": null
      }
    },
    {
      "operationId": "api:GET:/api/health",
      "method": "GET",
      "path": "/api/health",
      "source": {
        "file": "src/app/api/health/route.ts",
        "exportKind": "function-declaration",
        "localName": "GET",
        "moduleSpecifier": null
      }
    },
    {
      "operationId": "api:GET:/api/import/batches",
      "method": "GET",
      "path": "/api/import/batches",
      "source": {
        "file": "src/app/api/import/batches/route.ts",
        "exportKind": "function-declaration",
        "localName": "GET",
        "moduleSpecifier": null
      }
    },
    {
      "operationId": "api:POST:/api/import/batches",
      "method": "POST",
      "path": "/api/import/batches",
      "source": {
        "file": "src/app/api/import/batches/route.ts",
        "exportKind": "function-declaration",
        "localName": "POST",
        "moduleSpecifier": null
      }
    },
    {
      "operationId": "api:GET:/api/import/batches/{param}",
      "method": "GET",
      "path": "/api/import/batches/[id]",
      "source": {
        "file": "src/app/api/import/batches/[id]/route.ts",
        "exportKind": "function-declaration",
        "localName": "GET",
        "moduleSpecifier": null
      }
    },
    {
      "operationId": "api:POST:/api/import/batches/{param}/apply",
      "method": "POST",
      "path": "/api/import/batches/[id]/apply",
      "source": {
        "file": "src/app/api/import/batches/[id]/apply/route.ts",
        "exportKind": "function-declaration",
        "localName": "POST",
        "moduleSpecifier": null
      }
    },
    {
      "operationId": "api:POST:/api/import/batches/{param}/revert",
      "method": "POST",
      "path": "/api/import/batches/[id]/revert",
      "source": {
        "file": "src/app/api/import/batches/[id]/revert/route.ts",
        "exportKind": "function-declaration",
        "localName": "POST",
        "moduleSpecifier": null
      }
    },
    {
      "operationId": "api:PATCH:/api/import/batches/{param}/rows/{param}",
      "method": "PATCH",
      "path": "/api/import/batches/[id]/rows/[rowId]",
      "source": {
        "file": "src/app/api/import/batches/[id]/rows/[rowId]/route.ts",
        "exportKind": "function-declaration",
        "localName": "PATCH",
        "moduleSpecifier": null
      }
    },
    {
      "operationId": "api:POST:/api/import/preview",
      "method": "POST",
      "path": "/api/import/preview",
      "source": {
        "file": "src/app/api/import/preview/route.ts",
        "exportKind": "function-declaration",
        "localName": "POST",
        "moduleSpecifier": null
      }
    },
    {
      "operationId": "api:POST:/api/import/sessions",
      "method": "POST",
      "path": "/api/import/sessions",
      "source": {
        "file": "src/app/api/import/sessions/route.ts",
        "exportKind": "function-declaration",
        "localName": "POST",
        "moduleSpecifier": null
      }
    },
    {
      "operationId": "api:GET:/api/import/sessions/{param}",
      "method": "GET",
      "path": "/api/import/sessions/[id]",
      "source": {
        "file": "src/app/api/import/sessions/[id]/route.ts",
        "exportKind": "function-declaration",
        "localName": "GET",
        "moduleSpecifier": null
      }
    },
    {
      "operationId": "api:POST:/api/import/sessions/{param}/revert",
      "method": "POST",
      "path": "/api/import/sessions/[id]/revert",
      "source": {
        "file": "src/app/api/import/sessions/[id]/revert/route.ts",
        "exportKind": "function-declaration",
        "localName": "POST",
        "moduleSpecifier": null
      }
    },
    {
      "operationId": "api:GET:/api/insights",
      "method": "GET",
      "path": "/api/insights",
      "source": {
        "file": "src/app/api/insights/route.ts",
        "exportKind": "function-declaration",
        "localName": "GET",
        "moduleSpecifier": null
      }
    },
    {
      "operationId": "api:GET:/api/insights/csv",
      "method": "GET",
      "path": "/api/insights/csv",
      "source": {
        "file": "src/app/api/insights/csv/route.ts",
        "exportKind": "function-declaration",
        "localName": "GET",
        "moduleSpecifier": null
      }